web-scraper-order,web-scraper-start-url,Product_Name,Product_Price,Product_Sold
"1713627386-1583","https://shopee.co.id/ipenpart?originalCategoryId=11044458#product_list","IC Power MT6366W Poco M4 Pro 4G Original New Tested MT 6366W","Rp94.400","51 Terjual"
"1713627386-1584","https://shopee.co.id/ipenpart?originalCategoryId=11044458#product_list","Tombol Luar Asus Zenfone Max Pro M1 Zb601kl Zb602KL Switch On Off Power Volume","Rp16.600","23 Terjual"
"1713627386-1585","https://shopee.co.id/ipenpart?originalCategoryId=11044458#product_list","IC Power MT6315NP Redmi Note 10 5G MTK MT 6315NP Xiaomi","Rp112.600","17 Terjual"
"1713627386-1586","https://shopee.co.id/ipenpart?originalCategoryId=11044458#product_list","Kaca Plus Ring Kamera Oppo A5S Original Lensa Camera Belakang","Rp9.600","10 Terjual"
"1713627386-1587","https://shopee.co.id/ipenpart?originalCategoryId=11044458#product_list","Flex Papan Cas Infinix Smart 4 X653 X653C Flexible Ui Board Charging","Rp23.300","2 Terjual"
"1713627386-1588","https://shopee.co.id/ipenpart?originalCategoryId=11044458#product_list","IC CPU MT6785V CC Original New Tested MT 6785V","Rp244.300","12 Terjual"
"1713627386-1589","https://shopee.co.id/ipenpart?originalCategoryId=11044458#product_list","Flexible Cas X688B Infinix Hot 11 Play Original Flex Papan Konektor Charging Ces Board Charger Fleksibel","Rp35.500","5 Terjual"
"1713627386-1590","https://shopee.co.id/ipenpart?originalCategoryId=11044458#product_list","IC Power MT6365VPW Mediatek MT 6365VPW","Rp96.600","48 Terjual"
"1713627386-1591","https://shopee.co.id/ipenpart?originalCategoryId=11044458#product_list","Buzer Fullset Infinix Hot 10s X689 Buzzer Loudspeaker Dering Musik","Rp26.600","14 Terjual"
"1713627386-1592","https://shopee.co.id/ipenpart?originalCategoryId=11044458#product_list","IC Camera lph X 4 Pins","Rp23.300","1 Terjual"
"1713627386-1593","https://shopee.co.id/ipenpart?originalCategoryId=11044458#product_list","Flex Papan Cas C11 2021 Realme Fleksibel Ui Board Flexibel Charging","Rp23.300","64 Terjual"
"1713627386-1594","https://shopee.co.id/ipenpart?originalCategoryId=11044458#product_list","Tombol Luar Volume Vivo Y12S Y20 Original Outside Volume Button","Rp18.600","16 Terjual"
"1713627386-1595","https://shopee.co.id/ipenpart?originalCategoryId=11044458#product_list","Konektor Lcd Vivo S1 Socket Connector Layar","Rp16.600","3 Terjual"
"1713627386-1596","https://shopee.co.id/ipenpart?originalCategoryId=11044458#product_list","IC PA 77040 Xiaomi Mi 11 Original New Tested RF77040","Rp42.200","4 Terjual"
"1713627386-1597","https://shopee.co.id/ipenpart?originalCategoryId=11044458#product_list","Flexible Volume Redmi Note 10 Pro Flex Power On Off Switch Xiaomi","Rp12.600","16 Terjual"
"1713627386-1598","https://shopee.co.id/ipenpart?originalCategoryId=11044458#product_list","Flexible Board Redmi S2 Fleksibel Main Sub Flex Xiaomi","Rp17.200","6 Terjual"
"1713627386-1599","https://shopee.co.id/ipenpart?originalCategoryId=11044458#product_list","Kaca Kamera Oppo A74 Original Lensa Camera Bawaan Lens Lense Lapisan","Rp13.600","19 Terjual"
"1713627386-1600","https://shopee.co.id/ipenpart?originalCategoryId=11044458#product_list","Flex Lcd Xiaomi Mi Note 10 Pro Flexible Penghubung Fleksibel Layar","Rp45.500","14 Terjual"
"1713627386-1601","https://shopee.co.id/ipenpart?originalCategoryId=11044458#product_list","Papan Cas Oppo A54 5G Flexible Charger Konektor Charging Board","Rp28.600","29 Terjual"
"1713627386-1602","https://shopee.co.id/ipenpart?originalCategoryId=11044458#product_list","Ic Power Pm8350 Mi 11 Xiaomi Original New Tested PM 8350 004","Rp133.500","9 Terjual"
"1713627386-1603","https://shopee.co.id/ipenpart?originalCategoryId=11044458#product_list","Tempered Glass Realme 6 Pro Bening Pelindung Layar Screen Guard Clear","Rp8.600","4 Terjual"
"1713627386-1604","https://shopee.co.id/ipenpart?originalCategoryId=11044458#product_list","IC Cpu MT6737V Original New Tested MT6737 6737V","Rp96.300","24 Terjual"
"1713627386-1605","https://shopee.co.id/ipenpart?originalCategoryId=11044458#product_list","Antena Cover Redmi 4A Baru Fullset Tutup Mesin","Rp38.500","2 Terjual"
"1713627386-1606","https://shopee.co.id/ipenpart?originalCategoryId=11044458#product_list","IC Power 98925ewv Huawei P8 Max98925Ewv Original New Tested","Rp38.500","2 Terjual"
"1713627386-1607","https://shopee.co.id/ipenpart?originalCategoryId=11044458#product_list","Konektor Lcd Y55 Y66 Vivo Original Socket Connector Soket Layar","Rp16.600","8 Terjual"
"1713627386-1608","https://shopee.co.id/ipenpart?originalCategoryId=11044458#product_list","IC Cas 358s1947 Asus Zenfone 3 Original New Tested 358s 1947 Charger Charging","Rp25.200","20 Terjual"
"1713627386-1609","https://shopee.co.id/ipenpart?originalCategoryId=11044458#product_list","IC Audio 8738 Xiaomi Redmi 3S Original New Tested","Rp16.500","5 Terjual"
"1713627386-1610","https://shopee.co.id/ipenpart?originalCategoryId=11044458#product_list","IC Cas Et9539AM Original New Tested Charging Charger Ori ET 9539AM","Rp38.600","20 Terjual"
"1713627386-1611","https://shopee.co.id/ipenpart?originalCategoryId=11044458#product_list","Kaca Kamera Redmi Note 12 Pro 5G Lensa Camera Lens Belakang Xiaomi","Rp13.850Rp14.400-4%","19 Terjual"
"1713627386-1612","https://shopee.co.id/ipenpart?originalCategoryId=11044458#product_list","Kaca Lensa Kamera Y19 Vivo Original Lens Camera Lense","Rp8.600","8 Terjual"
"1713627386-1613","https://shopee.co.id/ipenpart?originalCategoryId=11044458#product_list","Kaca Kamera Realme U1 Lensa Original Bawaan Camera Belakang","Rp8.600","13 Terjual"
"1713627386-1614","https://shopee.co.id/ipenpart?originalCategoryId=11044458#product_list","Flex Papan Cas Redmi Note 9 Pro 4G Fast Charging Board Flexible Xiaomi Ces Fleksibel Charger","Rp65.600","18 Terjual"
"1713627386-1615","https://shopee.co.id/ipenpart?originalCategoryId=11044458#product_list","IC Triode RY Q3201 Q3200 Dioda Original New Tested","Rp25.500","26 Terjual"
"1713627386-1616","https://shopee.co.id/ipenpart?originalCategoryId=11044458#product_list","IC Power MT6360RP Mediatek MT 6360RP","Rp36.300","24 Terjual"
"1713627386-1617","https://shopee.co.id/ipenpart?originalCategoryId=11044458#product_list","Flexible Volume Narzo 20 Realme Tombol Fleksibel Original","Rp9.600","14 Terjual"
"1713627386-1618","https://shopee.co.id/ipenpart?originalCategoryId=11044458#product_list","IC Power 338S00309 Ip 8 Original New Tested","Rp38.600","13 Terjual"
"1713627386-1619","https://shopee.co.id/ipenpart?originalCategoryId=11044458#product_list","Plat Bga Ip 6S Amaoe Original Cetakan Stencil","Rp52.600","6 Terjual"
"1713627386-1620","https://shopee.co.id/ipenpart?originalCategoryId=11044458#product_list","Tempered Glass Oppo A31 Bening Pelindung Layar Screen Guard Clear","Rp8.600","7 Terjual"
"1713627386-1621","https://shopee.co.id/ipenpart?originalCategoryId=11044458#product_list","Kaca Kamera Redmi Note 11 Pro Plus 5G Lensa Camera Lense Lens Xiaomi","Rp13.300Rp16.600-20%","16 Terjual"
"1713627386-1622","https://shopee.co.id/ipenpart?originalCategoryId=11044458#product_list","Flex On Off Vivo Y01 Y16 Y15S Flexibel Switch Power Fleksibel Volume","Rp11.200","63 Terjual"
"1713627386-1623","https://shopee.co.id/ipenpart?originalCategoryId=11044458#product_list","Flex On Off Oppo A17 A17K Flexibel Switch Power Fleksibel Volume","Rp11.400","29 Terjual"
"1713627386-1624","https://shopee.co.id/ipenpart?originalCategoryId=11044458#product_list","Slot SimTray Vivo V5 Lite Y55 Y66 Original Sim Tray Tempat Kartu Card","Rp13.300","20 Terjual"
"1713627386-1625","https://shopee.co.id/ipenpart?originalCategoryId=11044458#product_list","Tombol Luar Oppo A1K Outside Button On Off Power Switch","Rp11.200","97 Terjual"
"1713627386-1626","https://shopee.co.id/ipenpart?originalCategoryId=11044458#product_list","Lem Putih Susu T9000 Mechanic 15ML Original Perekat Serba Guna","Rp12.600","89 Terjual"
"1713627386-1627","https://shopee.co.id/ipenpart?originalCategoryId=11044458#product_list","Konektor LCD Realme C25Y Original Socket Connector Layar","Rp21.200","23 Terjual"
"1713627386-1628","https://shopee.co.id/ipenpart?originalCategoryId=11044458#product_list","Konektor Mainboard Vivo Y12S Original Socket Flex Connector Flexibel","Rp21.100","29 Terjual"
"1713627386-1629","https://shopee.co.id/ipenpart?originalCategoryId=11044458#product_list","Flex On Off Vivo Y02 Flexibel Switch Power Fleksibel Volume","Rp11.600","20 Terjual"
"1713627386-1630","https://shopee.co.id/ipenpart?originalCategoryId=11044458#product_list","Konektor Mainboard Flex Mi 10T Mi10T Pro Soket Connector Flexibel Di Mesin Xiaomi","Rp22.500","21 Terjual"
"1713627386-1631","https://shopee.co.id/ipenpart?originalCategoryId=11044458#product_list","Flex On Off Oppo A58 A78 Flexibel Power  Fleksibel Switch Flexible","Rp11.600","4 Terjual"
"1713627386-1632","https://shopee.co.id/ipenpart?originalCategoryId=11044458#product_list","IC Charging MU106X01-5 Samsung M30 MU106x01 Cas","Rp45.500","27 Terjual"
"1713627386-1633","https://shopee.co.id/ipenpart?originalCategoryId=11044458#product_list","Konektor Cas Aja Samsung S20 Plus Connector Charging Usb Port Only","Rp23.300","33 Terjual"
"1713627386-1634","https://shopee.co.id/ipenpart?originalCategoryId=11044458#product_list","Kawat Pemisah LCD 0.03 MM Benang Pelepas Touchscreen","Rp22.500","8 Terjual"
"1713627386-1635","https://shopee.co.id/ipenpart?originalCategoryId=11044458#product_list","Konektor Baterai Reno 5F Oppo Soket Connector Battery Socket Batere","Rp18.600","7 Terjual"
"1713627386-1636","https://shopee.co.id/ipenpart?originalCategoryId=11044458#product_list","IC CPU MT6765V CB Oppo A15 Original New Tested MT 6765V MT6765V-CB","Rp176.600","27 Terjual"
"1713627386-1637","https://shopee.co.id/ipenpart?originalCategoryId=11044458#product_list","Konektor LCD Xiaomi Mi10T Mi 10T Pro Original Socket Connector Layar","Rp23.300","2 Terjual"
"1713627386-1638","https://shopee.co.id/ipenpart?originalCategoryId=11044458#product_list","IC Baseband Shannon955 955B Shannon955B Shannon","Rp36.600","13 Terjual"
"1713627386-1639","https://shopee.co.id/ipenpart?originalCategoryId=11044458#product_list","IC Cas SM5602 Redmi Note 11 Original New Tested Charging Xiaomi 5602","Rp36.600","4 Terjual"
"1713627386-1640","https://shopee.co.id/ipenpart?originalCategoryId=11044458#product_list","Tombol Luar Samsung S10 Plus Outside Power Volume Button On Off Switch Original","Rp22.500","13 Terjual"
"1713627386-1641","https://shopee.co.id/ipenpart?originalCategoryId=11044458#product_list","Flexibel Board Infinix Zero Ultra 5G X6820 Fleksibel Penghubung Sub Main Flex Flexible","Rp33.600",""
"1713627386-1642","https://shopee.co.id/ipenpart?originalCategoryId=11044458#product_list","Plat Cetakan HW16 SM7325 778G Huawei Bga Stencil Amaoe Original","Rp48.400","12 Terjual"
"1713627386-1643","https://shopee.co.id/ipenpart?originalCategoryId=11044458#product_list","IC Cas SMB1351 013 Original New Tested SMB 1351 SMB1351-013 Charging","Rp66.500","4 Terjual"
"1713627386-1644","https://shopee.co.id/ipenpart?originalCategoryId=11044458#product_list","IC Display Lampu LQ Redmi Note 11 Pro 5G Original New Tested Xiaomi","Rp26.600","5 Terjual"
"1713627386-1645","https://shopee.co.id/ipenpart?originalCategoryId=11044458#product_list","Flexible On Off Vivo V5 Y67 Flexibel Switch Tombol Flex Power Volume","Rp11.400","10 Terjual"
"1713627386-1646","https://shopee.co.id/ipenpart?originalCategoryId=11044458#product_list","Flexible Volume Realme 6 Flexibel Switch Tombol Flex Volum","Rp9.600",""
"1713627386-1647","https://shopee.co.id/ipenpart?originalCategoryId=11044458#product_list","Flexibel Board Infinix Zero 20 X6821 Fleksibel Penghubung Sub Main Flexible Flex","Rp33.200","1 Terjual"
"1713627386-1648","https://shopee.co.id/ipenpart?originalCategoryId=11044458#product_list","Flex On Off Redmi 12C Flexibel Switch Power Fleksibel Volume Xiaomi","Rp12.200",""
"1713627386-1649","https://shopee.co.id/ipenpart?originalCategoryId=11044458#product_list","IC CPU SM6375 100-AB Redmi Note 11 Pro 5G Original New Tested SM 6375","Rp268.600","2 Terjual"
"1713627386-1650","https://shopee.co.id/ipenpart?originalCategoryId=11044458#product_list","IC Power PMR735A Mi 11 Xiaomi Original New Tested PMR 735A","Rp66.500","5 Terjual"
"1713627386-1651","https://shopee.co.id/ipenpart?originalCategoryId=11044458#product_list","Konektor Sim Card Samsung S10 Plus Original Connector Kartu Bagian Dalam","Rp35.500",""
"1713627386-1652","https://shopee.co.id/ipenpart?originalCategoryId=11044458#product_list","IC Cas ETA6963 Original New Tested Charging ETA Charger 6963","Rp28.300",""
"1713627386-1653","https://shopee.co.id/ipenpart?originalCategoryId=11044458#product_list","Flexibel Samsung Z Fold 2 SM-F916 Fleksibel Penghubung Flex Engsel Flexible","Rp215.500",""
"1713627386-1654","https://shopee.co.id/ipenpart?originalCategoryId=11044458#product_list","IC R010 Original New Tested","Rp5.600","4 Terjual"
"1713627386-1655","https://shopee.co.id/ipenpart?originalCategoryId=11044458#product_list","Flex Papan Cas Samsung A14 A145F Flexibel Board Fleksibel Charging","Rp63.600",""
"1713627386-1656","https://shopee.co.id/ipenpart?originalCategoryId=11044458#product_list","Kaca Kamera Samsung S20 Ultra Lensa Camera Lens Belakang Lense","Rp16.600","6 Terjual"
"1713627386-1657","https://shopee.co.id/ipenpart?originalCategoryId=11044458#product_list","Flex On Off Realme 3 Original Flexibel Switch Fleksib Power","Rp8.600","1 Terjual"
"1713627386-1658","https://shopee.co.id/ipenpart?originalCategoryId=11044458#product_list","Buzer Samsung A02S A03S Buzzer Loudspeaker Dering Musik","Rp25.500",""
"1713627386-1659","https://shopee.co.id/ipenpart?originalCategoryId=11044458#product_list","IC Audio WCD9375 001 Original New Tested WCD 9375","Rp158.600","2 Terjual"
"1713627386-1660","https://shopee.co.id/ipenpart?originalCategoryId=11044458#product_list","Konektor Lcd Oppo A95 Original Soket Connector Layar","Rp21.600",""
"1713627386-1661","https://shopee.co.id/ipenpart?originalCategoryId=11044458#product_list","Flex Papan Cas Redmi 10C Xiaomi Flexible Ui Board Fleksibel Charging","Rp25.600","10 Terjual"
"1713627386-1662","https://shopee.co.id/ipenpart?originalCategoryId=11044458#product_list","IC RF S735 Samsung S7","Rp38.300","3 Terjual"
"1713627386-1663","https://shopee.co.id/ipenpart?originalCategoryId=11044458#product_list","Konektor Mainboard Flex Oppo A95 Soket Connector Flexibel Di Mesin","Rp21.700",""
"1713627386-1664","https://shopee.co.id/ipenpart?originalCategoryId=11044458#product_list","Flexibel Board Infinix Hot 12 Pro X6818 Fleksibel Penghubung Sub Main Flex Flexible","Rp33.200",""
"1713627386-1665","https://shopee.co.id/ipenpart?originalCategoryId=11044458#product_list","Flexibel Papan Cas Samsung A11 A115F Fast Charging Konektor Charger Board Flexible Flex Ces","Rp56.600","6 Terjual"
"1713627386-1666","https://shopee.co.id/ipenpart?originalCategoryId=11044458#product_list","Flexible Board Samsung A03S Fleksibel Penghubung Flexibel Sub Main","Rp36.300",""
"1713627386-1667","https://shopee.co.id/ipenpart?originalCategoryId=11044458#product_list","Glass Sudah Oca Realme 9 Kaca Touch Layar LCD Depan Touchscreen","Rp17.600","4 Terjual"
"1713627386-1668","https://shopee.co.id/ipenpart?originalCategoryId=11044458#product_list","IC Wifi Hi1103 V110 Huawei P30 Pro Hi 1103","Rp56.600","9 Terjual"
"1713627386-1669","https://shopee.co.id/ipenpart?originalCategoryId=11044458#product_list","Kaca Lensa Kamera Redmi 9T Original Lens Camera Belakang Lense Xiaomi","Rp18.600","10 Terjual"
"1713627386-1670","https://shopee.co.id/ipenpart?originalCategoryId=11044458#product_list","Flexible Volume Oppo A91 Original Tombol Switch Flex Fleksibel","Rp9.300","1 Terjual"
"1713627386-1671","https://shopee.co.id/ipenpart?originalCategoryId=11044458#product_list","Flex On Off Samsung A13 4G A135F Flexibel Power Fleksibel Switch","Rp18.600","34 Terjual"
"1713627386-1672","https://shopee.co.id/ipenpart?originalCategoryId=11044458#product_list","Konektor Cas Aja Mi Max 3 Xiaomi Original Port Usb Charging Ces Only","Rp9.400","31 Terjual"
"1713627386-1673","https://shopee.co.id/ipenpart?originalCategoryId=11044458#product_list","Flex Volume Oppo F11 Pro Flexible Switch Fleksibel Volum Flexibel","Rp8.600","6 Terjual"
"1713627386-1674","https://shopee.co.id/ipenpart?originalCategoryId=11044458#product_list","Flexible Board Samsung A536B A53 5G Flex Tengah Fleksibel Penghubung","Rp53.300","24 Terjual"
"1713627386-1675","https://shopee.co.id/ipenpart?originalCategoryId=11044458#product_list","IC Cas Usb 3Z Samsung S21 Charging","Rp43.300","15 Terjual"
"1713627386-1676","https://shopee.co.id/ipenpart?originalCategoryId=11044458#product_list","Flex On Off Techno Spark 6 Flexibel Volume Switch Fleksibel Power","Rp7.500","23 Terjual"
"1713627386-1677","https://shopee.co.id/ipenpart?originalCategoryId=11044458#product_list","Fleksibel Board Redmi Note 12 Pro 5G Flexible Xiaomi Flex Sub Main","Rp43.300","22 Terjual"
"1713627386-1678","https://shopee.co.id/ipenpart?originalCategoryId=11044458#product_list","IC Audio 874D Asus Rog Phone 2 Original New Tested","Rp34.300","17 Terjual"
"1713627386-1679","https://shopee.co.id/ipenpart?originalCategoryId=11044458#product_list","Plat Cetakan U-SMG5 Exynos2200 E9925 Exynos 990 2200 Original Amaoe BGA Stencil","Rp53.600","7 Terjual"
"1713627386-1680","https://shopee.co.id/ipenpart?originalCategoryId=11044458#product_list","IC PA SMMI S5643-62 Realme C21Y Original New Tested S5643 62","Rp43.700","9 Terjual"
"1713627386-1681","https://shopee.co.id/ipenpart?originalCategoryId=11044458#product_list","IC Audio 874C Huawei","Rp33.200","8 Terjual"
"1713627386-1682","https://shopee.co.id/ipenpart?originalCategoryId=11044458#product_list","IC Display LUH Redmi 10 Prime original New Tested Light Layar Xiaomi","Rp44.300","21 Terjual"
"1713627386-1683","https://shopee.co.id/ipenpart?originalCategoryId=11044458#product_list","Flexible Board Mi 11 Lite Fleksibel Xiaomi Flex Mi11 Lite","Rp35.500","4 Terjual"
"1713627386-1684","https://shopee.co.id/ipenpart?originalCategoryId=11044458#product_list","Tombol Luar Samsung S8 Plus Outside Power Volume Button On Off Original","Rp18.600","8 Terjual"
"1713627386-1685","https://shopee.co.id/ipenpart?originalCategoryId=11044458#product_list","Ic Baseband Sdr735 001","Rp38.300","15 Terjual"
"1713627386-1686","https://shopee.co.id/ipenpart?originalCategoryId=11044458#product_list","IC Display TPS65656A2 lp 12 Pro Max Mini TPS 65656A2 Original","Rp66.200","6 Terjual"
"1713627386-1687","https://shopee.co.id/ipenpart?originalCategoryId=11044458#product_list","Konektor Baterai Redmi 3 4x Xiaomi Original Battery Connector Batere","Rp12.200","9 Terjual"
"1713627386-1688","https://shopee.co.id/ipenpart?originalCategoryId=11044458#product_list","Buzer Vivo Y50 Original Buzzer Dering Loudspeaker Music","Rp43.300","2 Terjual"
"1713627386-1689","https://shopee.co.id/ipenpart?originalCategoryId=11044458#product_list","IC Audio DGY3 36 Pin Huawei","Rp28.500","9 Terjual"
"1713627386-1690","https://shopee.co.id/ipenpart?originalCategoryId=11044458#product_list","IC Wifi WCN3950 005 Redmi Note 12 Original New Tested WCN 3950 Xiaomi","Rp56.600","9 Terjual"
"1713627386-1691","https://shopee.co.id/ipenpart?originalCategoryId=11044458#product_list","Flexible Papan Cas Vivo S1 Fleksibel Charging Flex Board Ces","Rp28.600","2 Terjual"
"1713627386-1692","https://shopee.co.id/ipenpart?originalCategoryId=11044458#product_list","Kaca Kamera Redmi Note 11 Pro 4G Lensa Camera Lens Belakang Xiaomi Original","Rp25.500","2 Terjual"
"1713627386-1693","https://shopee.co.id/ipenpart?originalCategoryId=11044458#product_list","IC Power PM7325 Original New Tested PM7325","Rp96.600","4 Terjual"
"1713627386-1694","https://shopee.co.id/ipenpart?originalCategoryId=11044458#product_list","Tombol Luar Huawei Nova 3i Outside Power Volume Button On Off Original","Rp26.600","9 Terjual"
"1713627386-1695","https://shopee.co.id/ipenpart?originalCategoryId=11044458#product_list","Flex Papan Cas Samsung T225 Tab A7 Lite Flexible Charging Board PCB","Rp83.300","1 Terjual"
"1713627386-1696","https://shopee.co.id/ipenpart?originalCategoryId=11044458#product_list","Flex On Off Realme 8i Flexible Power Switch Fleksibel Button","Rp13.300","10 Terjual"
"1713627386-1697","https://shopee.co.id/ipenpart?originalCategoryId=11044458#product_list","Kaca Kamera Oppo Reno 5F Lensa Camera Lens Belakang","Rp16.600","5 Terjual"
"1713627386-1698","https://shopee.co.id/ipenpart?originalCategoryId=11044458#product_list","Kaca Kamera Realme 8 Lensa Camera Lens Belakang Lense","Rp16.600","10 Terjual"
"1713627386-1699","https://shopee.co.id/ipenpart?originalCategoryId=11044458#product_list","Flexible On Off Realme C30 Fleksibel Tombol Flex Switch Volume","Rp12.200","2 Terjual"
"1713627386-1700","https://shopee.co.id/ipenpart?originalCategoryId=11044458#product_list","IC Display ND 24 Pin Huawei Nova 5i Light Lampu Original New Tested","Rp43.300","1 Terjual"
"1713627386-1701","https://shopee.co.id/ipenpart?originalCategoryId=11044458#product_list","Flexible Sim Poco F3 Fleksibel Reader Kartu Flex Simcard","Rp86.600","3 Terjual"
"1713627386-1702","https://shopee.co.id/ipenpart?originalCategoryId=11044458#product_list","Flex Board Redmi Note 11 Pro 5G Fleksibel Mainboard Flexible Sub Xiaomi","Rp56.700","16 Terjual"
"1713627386-1703","https://shopee.co.id/ipenpart?originalCategoryId=11044458#product_list","IC PA S2916-51 Huawei Mate 30 Pro Original New Tested S2916","Rp37.300","4 Terjual"
"1713627386-1704","https://shopee.co.id/ipenpart?originalCategoryId=11044458#product_list","IC Power 343S00511 Original New Tested 13 Pro Max 0511","Rp65.300","3 Terjual"
"1713627386-1705","https://shopee.co.id/ipenpart?originalCategoryId=11044458#product_list","Kaca Kamera Poco M5 Lensa Camera Lens Belakang","Rp15.200","11 Terjual"
"1713627386-1706","https://shopee.co.id/ipenpart?originalCategoryId=11044458#product_list","Flex Papan Cas Redmi Note 7 Fast Charging Board Flexible Xiaomi Ces Fleksibel Charger","Rp58.300","4 Terjual"
"1713627386-1707","https://shopee.co.id/ipenpart?originalCategoryId=11044458#product_list","IC Power PM8350BH Xiaomi Mi 11 Original New Tested PM 8350 BH PM8350","Rp133.600","3 Terjual"
"1713627386-1708","https://shopee.co.id/ipenpart?originalCategoryId=11044458#product_list","Fingerprint Redmi 10 Prime Sidik Jari Xiaomi Sensor Finger Print","Rp86.600","8 Terjual"
"1713627386-1709","https://shopee.co.id/ipenpart?originalCategoryId=11044458#product_list","Slot Sim Tray A5s Oppo Original Simtray Lock Tempat Kartu Card","Rp18.600","6 Terjual"
"1713627386-1710","https://shopee.co.id/ipenpart?originalCategoryId=11044458#product_list","Slot Simtray Realme Narzo 20 Original Sim Lock Tempat Tray","Rp12.200","7 Terjual"
"1713627386-1711","https://shopee.co.id/ipenpart?originalCategoryId=11044458#product_list","Flex Papan Cas Realme 8i Flexible Charging Fleksibel Ui Board Cas","Rp25.500",""
"1713627386-1712","https://shopee.co.id/ipenpart?originalCategoryId=11044458#product_list","Konektor Baterai Samsung S21 Plus S22 Ultra Original Soket Connector Socket Batere","Rp18.600",""
"1713627386-1713","https://shopee.co.id/ipenpart?originalCategoryId=11044458#product_list","IC Camera 338s00510 Ip 11 Pro 338s00510-b0 Kamera","Rp86.600","4 Terjual"
"1713627386-1714","https://shopee.co.id/ipenpart?originalCategoryId=11044458#product_list","UC Audio CS35L84A Ipad 10 Pro 10.5 Original New Tested CS 35L84A","Rp96.600",""
"1713627386-1715","https://shopee.co.id/ipenpart?originalCategoryId=11044458#product_list","Flexible Volume Poco F3 5G Flexibel Switch Fleksibel Volum Redmi K40","Rp12.200","2 Terjual"
"1713627386-1716","https://shopee.co.id/ipenpart?originalCategoryId=11044458#product_list","IC Cas 6S30A Ipad Pro 3 Original New Tested","Rp133.500",""
"1713627386-1717","https://shopee.co.id/ipenpart?originalCategoryId=11044458#product_list","Konektor Baterai Redmi Note 11 Original Socket Connector Battery Xiaomi","Rp18.400","2 Terjual"
"1713627386-1718","https://shopee.co.id/ipenpart?originalCategoryId=11044458#product_list","Kaca Kamera Xiaomi 12T 5G Lensa Camera Lens Belakang","Rp23.200","11 Terjual"
"1713627386-1719","https://shopee.co.id/ipenpart?originalCategoryId=11044458#product_list","Flexible Papan Cas Vivo Y16 2022 Fleksibel Ui Flex Charging Board","Rp25.500","5 Terjual"
"1713627386-1720","https://shopee.co.id/ipenpart?originalCategoryId=11044458#product_list","Buzer Vivo Y12 Buzzer Loudspeaker Dering","Rp17.600","1 Terjual"
"1713627386-1721","https://shopee.co.id/ipenpart?originalCategoryId=11044458#product_list","Buzer Redmi Note 11 4G Original Buzzer Dering Loudspeaker Music Xiaomi","Rp36.600","4 Terjual"
"1713627386-1722","https://shopee.co.id/ipenpart?originalCategoryId=11044458#product_list","IC Display TPS65657B0 Iph 14 Pro Max Original New Tested","Rp93.300",""
"1713627386-1723","https://shopee.co.id/ipenpart?originalCategoryId=11044458#product_list","IC Lampu AL61 Original New Tested Display 61 AL","Rp23.200","8 Terjual"
"1713627386-1724","https://shopee.co.id/ipenpart?originalCategoryId=11044458#product_list","Buzer Poco M3 Pro 4G Buzzer Loudspeaker Dering Music Original","Rp35.600","2 Terjual"
"1713627386-1725","https://shopee.co.id/ipenpart?originalCategoryId=11044458#product_list","Flexible Board Kiri Reno 5F Flex Left Side Fleksibel Penghubung","Rp28.600","1 Terjual"
"1713627386-1726","https://shopee.co.id/ipenpart?originalCategoryId=11044458#product_list","Tombol Luar Volume Realme C35 Outside Button Switch Volum Side","Rp23.300","5 Terjual"
"1713627386-1727","https://shopee.co.id/ipenpart?originalCategoryId=11044458#product_list","Flex On Off Vivo V19 Fleksibel Switch Volume Flexible Tombol Power","Rp11.500","5 Terjual"
