web-scraper-order,web-scraper-start-url,Product_Name,Product_Price,Product_Sold
"1713627386-1","https://shopee.co.id/ipenpart?originalCategoryId=11044458#product_list","Switch Tombol On Off Kaki 4 Asus Oppo Vivo Xiaomi Swit Button Kecil Pins Power Volume","Rp1.650","10RB+ Terjual"
"1713627386-2","https://shopee.co.id/ipenpart?originalCategoryId=11044458#product_list","Konektor Cas Aja X680 Original Hot 9 10 Play Infinix Connector Charger","Rp2.600","10RB+ Terjual"
"1713627386-3","https://shopee.co.id/ipenpart?originalCategoryId=11044458#product_list","Konektor Cas BB Z3 Redmi 3 3s Original Connector Ces Charger A850 S920","Rp650","10RB+ Terjual"
"1713627386-4","https://shopee.co.id/ipenpart?originalCategoryId=11044458#product_list","IC CPU SM8150-503 AC SM 8150 103-AC X3 Pro Mi9 Mi9T Pro Blackshark 2 Original New Tested SM8150 503-AC","Rp267.500","2,6RB Terjual"
"1713627386-5","https://shopee.co.id/ipenpart?originalCategoryId=11044458#product_list","Konektor Cas Aja X657 Infinix X657B Smart 5 Connector Usb Ces Charger Only","Rp2.600","10RB+ Terjual"
"1713627386-6","https://shopee.co.id/ipenpart?originalCategoryId=11044458#product_list","Baut isi 200 Pcs Kualitas Oke","Rp6.500","2,4RB Terjual"
"1713627386-7","https://shopee.co.id/ipenpart?originalCategoryId=11044458#product_list","Connector Cas Saja Samsung A20 A30 A50 A12 A21S M20 Konektor Charger Port Usb Ces","Rp3.300","10RB+ Terjual"
"1713627386-8","https://shopee.co.id/ipenpart?originalCategoryId=11044458#product_list","Konektor Cas Connector Charger Smartfren Andromax Universal Ces","Rp650","10RB+ Terjual"
"1713627386-9","https://shopee.co.id/ipenpart?originalCategoryId=11044458#product_list","Konektor Cas Aja A01 Samsung Redmi 9A Original Connector Charger Ces","Rp2.600","10RB+ Terjual"
"1713627386-10","https://shopee.co.id/ipenpart?originalCategoryId=11044458#product_list","Konektor Lcd Samsung A12 A13 A125F A02 A52 Socket Connector Di Mesin Soket Layar A526B","Rp16.600","3,3RB Terjual"
"1713627386-11","https://shopee.co.id/ipenpart?originalCategoryId=11044458#product_list","Konektor Cas A5S A15 A15S A1K C11 Oppo Connector Charger Ces Only Port Usb","Rp2.600","10RB+ Terjual"
"1713627386-12","https://shopee.co.id/ipenpart?originalCategoryId=11044458#product_list","Konektor Cas Saja Redmi Note 5A Xiaomi Connector Charger Ces Only Port Usb","Rp1.200","10RB+ Terjual"
"1713627386-13","https://shopee.co.id/ipenpart?originalCategoryId=11044458#product_list","IC Rf WTR2965 Original 100% Xiaomi Redmi 3S 4A Note 5A 5 Plus Vivo  Joss WTR Sinyal 2965","Rp7.460Rp11.700-36%","10RB+ Terjual"
"1713627386-14","https://shopee.co.id/ipenpart?originalCategoryId=11044458#product_list","Konektor Cas Saja Redmi 5A 6A Xiaomi Connector Charger Ces Only Port Usb","Rp1.200","10RB+ Terjual"
"1713627386-15","https://shopee.co.id/ipenpart?originalCategoryId=11044458#product_list","IC PA VC7643 Original New Tested Rf VC 7643 62 Redmi Note 9","Rp34.400Rp46.600-26%","4,7RB Terjual"
"1713627386-16","https://shopee.co.id/ipenpart?originalCategoryId=11044458#product_list","Kaca Kamera Poco X3 Original Lensa Camera Belakang Lens","Rp11.600","322 Terjual"
"1713627386-17","https://shopee.co.id/ipenpart?originalCategoryId=11044458#product_list","Backdoor Redmi Note 10 4G Housing Tutup Casing Belakang Xiaomi","Rp45.500","8 Terjual"
"1713627386-18","https://shopee.co.id/ipenpart?originalCategoryId=11044458#product_list","Flexible Board Mi10T Xiaomi Mi 10T Pro Flex Sub Fleksibel MainBoard","Rp46.600","135 Terjual"
"1713627386-19","https://shopee.co.id/ipenpart?originalCategoryId=11044458#product_list","Kaca Kamera Redmi Note 10 PRO 4G Original Lensa Camera Belakang Lens","Rp12.600","1,4RB Terjual"
"1713627386-20","https://shopee.co.id/ipenpart?originalCategoryId=11044458#product_list","Kaca Kamera A02s Samsung Original Lensa Camera Belakang Lens","Rp11.200","237 Terjual"
"1713627386-21","https://shopee.co.id/ipenpart?originalCategoryId=11044458#product_list","Kaca Lensa Kamera Redmi 10 Original Lens Camera Lense","Rp13.300","2,6RB Terjual"
"1713627386-22","https://shopee.co.id/ipenpart?originalCategoryId=11044458#product_list","IC Power Supply Network Poco M3 9T QET4101 Original New Tested 4101 APT QET U115 Booster Redmi","Rp23.300","6,9RB Terjual"
"1713627386-23","https://shopee.co.id/ipenpart?originalCategoryId=11044458#product_list","Konektor Cas J100 J200 J500 Connector Charger Original Ces","Rp1.600","10RB+ Terjual"
"1713627386-24","https://shopee.co.id/ipenpart?originalCategoryId=11044458#product_list","Kaca Lensa Kamera Redmi Note 8 Original Camera Xiaomi Lens Belakang Lense","Rp10.640Rp11.200-5%","4,5RB Terjual"
"1713627386-25","https://shopee.co.id/ipenpart?originalCategoryId=11044458#product_list","Konektor Cas Aja A10S Samsung Original Connector Charger Ces","Rp2.600","10RB+ Terjual"
"1713627386-26","https://shopee.co.id/ipenpart?originalCategoryId=11044458#product_list","Switch On Off Small J2 Prime Samsung Original New Button Power Volume Swit","Rp2.600","10RB+ Terjual"
"1713627386-27","https://shopee.co.id/ipenpart?originalCategoryId=11044458#product_list","IC Power Pmi632-902 Redmi Note 8 Samsung A20s Original New Tested Pmi632 902-00","Rp36.600","3,5RB Terjual"
"1713627386-28","https://shopee.co.id/ipenpart?originalCategoryId=11044458#product_list","Konektor Cas Advan E1C Connector Charger Port Usb Ces","Rp750","10RB+ Terjual"
"1713627386-29","https://shopee.co.id/ipenpart?originalCategoryId=11044458#product_list","Kaca Lensa Kamera Zero 8i X687B Infinix Original Lens Camera Belakang 8","Rp16.500","313 Terjual"
"1713627386-30","https://shopee.co.id/ipenpart?originalCategoryId=11044458#product_list","Amaoe Free Halogen Paste Flux Songka Original","Rp56.600Rp65.300-13%","708 Terjual"
"1713627386-31","https://shopee.co.id/ipenpart?originalCategoryId=11044458#product_list","Konektor Cas Andromax Smartfren Connector Charger Ces Universal Andro Smart Fren","Rp650","10RB+ Terjual"
"1713627386-32","https://shopee.co.id/ipenpart?originalCategoryId=11044458#product_list","Konektor Cas Aja Vivo Y79 Y85 Connector Charger Ces Usb Port Charging","Rp2.700","10RB+ Terjual"
"1713627386-33","https://shopee.co.id/ipenpart?originalCategoryId=11044458#product_list","Timah Pasta Low Temp Amaoe Original Solder Paste 138 Soldering Cair","Rp105.200","553 Terjual"
"1713627386-34","https://shopee.co.id/ipenpart?originalCategoryId=11044458#product_list","Flexible Papan Cas Nokia 6.1 Plus X6 Flex Charger Board","Rp19.500","25 Terjual"
"1713627386-35","https://shopee.co.id/ipenpart?originalCategoryId=11044458#product_list","Konektor Cas Aja Oppo A5 A9 2020 Tipe C Connector Charger Ces","Rp3.300","6,3RB Terjual"
"1713627386-36","https://shopee.co.id/ipenpart?originalCategoryId=11044458#product_list","Konektor Cas X901 Oppo Original Connector Charger Ces","Rp650","10RB+ Terjual"
"1713627386-37","https://shopee.co.id/ipenpart?originalCategoryId=11044458#product_list","Konektor Cas J2 Prime Connector Ces Charger Charging Samsung","Rp1.600","10RB+ Terjual"
"1713627386-38","https://shopee.co.id/ipenpart?originalCategoryId=11044458#product_list","Konektor Cas Aja Samsung A10 A105F Original Port Usb Connector Charger","Rp4.400","2,5RB Terjual"
"1713627386-39","https://shopee.co.id/ipenpart?originalCategoryId=11044458#product_list","Mic Samsung A20 J4 Plus Modul Microphone Kualitas Bagus Mikrofon","Rp5.500","7,3RB Terjual"
"1713627386-40","https://shopee.co.id/ipenpart?originalCategoryId=11044458#product_list","IC Power PM8150B Original New Tested PM 8150B","Rp56.100","327 Terjual"
"1713627386-41","https://shopee.co.id/ipenpart?originalCategoryId=11044458#product_list","IC RF QM 56020 Redmi 8  Samsung A20S Original New Tested PA Qm56020","Rp36.300","2,3RB Terjual"
"1713627386-42","https://shopee.co.id/ipenpart?originalCategoryId=11044458#product_list","Konektor Cas Aja Redmi 5 Plus Xiaomi Connector Charger Ces Only","Rp1.300","10RB+ Terjual"
"1713627386-43","https://shopee.co.id/ipenpart?originalCategoryId=11044458#product_list","Konektor Cas Aja Vivo Y15s Connector Charger Usb Port Ces Charging Only","Rp2.600","4,2RB Terjual"
"1713627386-44","https://shopee.co.id/ipenpart?originalCategoryId=11044458#product_list","Kaca Kamera Poco M4 Pro 4G Lensa Camera Lens Belakang","Rp18.600","249 Terjual"
"1713627386-45","https://shopee.co.id/ipenpart?originalCategoryId=11044458#product_list","Konektor Cas Aja A52 A16 A74 Oppo Original Connector Charger Ces","Rp3.300","8,3RB Terjual"
"1713627386-46","https://shopee.co.id/ipenpart?originalCategoryId=11044458#product_list","Kaca Lensa Kamera A50S Samsung Original Camera Belakang Lens Lense","Rp13.600","471 Terjual"
"1713627386-47","https://shopee.co.id/ipenpart?originalCategoryId=11044458#product_list","Kaca Kamera Redmi Note 10S 10 s Original Lensa Camera Belakang Lens Xiaomi","Rp12.200Rp16.200-25%","1,4RB Terjual"
"1713627386-48","https://shopee.co.id/ipenpart?originalCategoryId=11044458#product_list","Konektor Cas Aja Vivo Y53 Y55 Y66 Connector Charger","Rp1.600","10RB+ Terjual"
"1713627386-49","https://shopee.co.id/ipenpart?originalCategoryId=11044458#product_list","Konektor Baterai Y91 Y93 Y95 Vivo Socket Connector Battery Batere","Rp14.400","197 Terjual"
"1713627386-50","https://shopee.co.id/ipenpart?originalCategoryId=11044458#product_list","Lensa Kamera Samsung A32 Kaca Camera Belakang Lens","Rp12.600","40 Terjual"
"1713627386-51","https://shopee.co.id/ipenpart?originalCategoryId=11044458#product_list","Kaca Kamera Samsung A12 Original Lensa Camera Belakang Lens","Rp12.300","437 Terjual"
"1713627386-52","https://shopee.co.id/ipenpart?originalCategoryId=11044458#product_list","Flex Papan Cas Redmi Note 10s Fast Charging Board Flexible Xiaomi Ces Fleksibel Charger With IC","Rp66.500","100 Terjual"
"1713627386-53","https://shopee.co.id/ipenpart?originalCategoryId=11044458#product_list","Konektor Cas Aja Vivo V5 Y67 Original Connector Charger Ces","Rp2.600","10RB+ Terjual"
"1713627386-54","https://shopee.co.id/ipenpart?originalCategoryId=11044458#product_list","Kaca Kamera Poco X3 GT Lensa Camera Lens Belakang","Rp14.400","38 Terjual"
"1713627386-55","https://shopee.co.id/ipenpart?originalCategoryId=11044458#product_list","Konektor Baterai lp Xr Xs Max Original Connector Battery Di Mesin","Rp23.300","227 Terjual"
"1713627386-56","https://shopee.co.id/ipenpart?originalCategoryId=11044458#product_list","IC CPU SM8250 002-AC Poco F3 Original New Tested SM8250-002-AC SM 8250","Rp335.200","127 Terjual"
"1713627386-57","https://shopee.co.id/ipenpart?originalCategoryId=11044458#product_list","Konektor Cas Tab A7 Lite T220 T225 Samsung Original Connector Charger","Rp15.700","142 Terjual"
"1713627386-58","https://shopee.co.id/ipenpart?originalCategoryId=11044458#product_list","Kaca Kamera Samsung M22 M32 Lensa Camera Lens Belakang","Rp13.600","29 Terjual"
"1713627386-59","https://shopee.co.id/ipenpart?originalCategoryId=11044458#product_list","Flexible On Off A15 A15s A16E Oppo Tombol Dalam Volume Fleksibel Power Original Flex","Rp8.600","1,1RB Terjual"
"1713627386-60","https://shopee.co.id/ipenpart?originalCategoryId=11044458#product_list","Konektor Cas Aja Redmi 10C Original Connector Charger Port Usb Only","Rp5.600","2,3RB Terjual"
"1713627386-61","https://shopee.co.id/ipenpart?originalCategoryId=11044458#product_list","IC CPU SM8150-503 AB Blackshark 2 Pro Original New Tested SM8150","Rp286.600","150 Terjual"
"1713627386-62","https://shopee.co.id/ipenpart?originalCategoryId=11044458#product_list","Konektor LCD Samsung A30S A21S A515F Original Socket Di Mesin Connector Soket A307F A217","Rp17.600","1,6RB Terjual"
"1713627386-63","https://shopee.co.id/ipenpart?originalCategoryId=11044458#product_list","Kaca Kamera Nova 5T Huawei Original Camera Lensa Bawaan Lens","Rp16.300","172 Terjual"
"1713627386-64","https://shopee.co.id/ipenpart?originalCategoryId=11044458#product_list","Konektor Cas Saja Vivo Y21S Original Connector Charger Port Usb Only","Rp8.600","2,2RB Terjual"
"1713627386-65","https://shopee.co.id/ipenpart?originalCategoryId=11044458#product_list","Konektor Cas Aja Oppo A37 Charger Connector Ces Port Usb Plug in Only","Rp1.400","10RB+ Terjual"
"1713627386-66","https://shopee.co.id/ipenpart?originalCategoryId=11044458#product_list","Konektor Cas Aja Redmi Note 11 4G Original Port Usb Ces Charging Only Xiaomi","Rp5.600","1,1RB Terjual"
"1713627386-67","https://shopee.co.id/ipenpart?originalCategoryId=11044458#product_list","Kaca Kamera Xiaomi Mi Note 10 Original Lensa Camera Lens Xiaomi","Rp23.500","62 Terjual"
"1713627386-68","https://shopee.co.id/ipenpart?originalCategoryId=11044458#product_list","Konektor Cas Aja Redmi Note 5 6 Pro Connector Usb Only Ces Charger Xiaomi","Rp1.400","10RB+ Terjual"
"1713627386-69","https://shopee.co.id/ipenpart?originalCategoryId=11044458#product_list","Kuas Kecil Lembut Cocok Untuk Membersihkan Mainboard","Rp5.600","2,6RB Terjual"
"1713627386-70","https://shopee.co.id/ipenpart?originalCategoryId=11044458#product_list","Konektor Cas Aja Mi5X A1 Charger Connector Ces Port Usb Plug in Xiaomi","Rp3.700","3RB Terjual"
"1713627386-71","https://shopee.co.id/ipenpart?originalCategoryId=11044458#product_list","IC Audio +98937 Ewx Redmi Note 7 Original New Tested Xiaomi Max98937","Rp34.400","586 Terjual"
"1713627386-72","https://shopee.co.id/ipenpart?originalCategoryId=11044458#product_list","Konektor Cas Aja Y91 Y95 Vivo Connector Ces Charger Port Usb","Rp1.300","10RB+ Terjual"
"1713627386-73","https://shopee.co.id/ipenpart?originalCategoryId=11044458#product_list","Coil Lampu Redmi 2 Vivo Oppo Original New Tested","Rp5.600","1,5RB Terjual"
"1713627386-74","https://shopee.co.id/ipenpart?originalCategoryId=11044458#product_list","Flex Papan Cas Redmi Note 10 4G Fast Charging Board Flexible Xiaomi Ces Fleksibel Charger","Rp66.500","57 Terjual"
"1713627386-75","https://shopee.co.id/ipenpart?originalCategoryId=11044458#product_list","Cetakan Universal IC Plat Amaoe Original BGA Bahan Jepang","Rp46.400","3,7RB Terjual"
"1713627386-76","https://shopee.co.id/ipenpart?originalCategoryId=11044458#product_list","Flex Board Xiaomi Mi 11T Pro Flexible Sub Mainboard Penghubung","Rp45.500","55 Terjual"
"1713627386-77","https://shopee.co.id/ipenpart?originalCategoryId=11044458#product_list","Kaca Kamera A02 Samsung Original Lensa Camera Belakang Lens","Rp9.300","79 Terjual"
"1713627386-78","https://shopee.co.id/ipenpart?originalCategoryId=11044458#product_list","IC Lampu AL65 Samsung A20s Vivo Y91 Y93 Y95 Al 65 Original New Tested Display Light","Rp18.300","985 Terjual"
"1713627386-79","https://shopee.co.id/ipenpart?originalCategoryId=11044458#product_list","Konektor Cas Saja Redmi Note 7 8 9 10 Pro Tipe C Type Ces Xiaomi Connector Charger Port Usb Charging","Rp2.600","10RB+ Terjual"
"1713627386-80","https://shopee.co.id/ipenpart?originalCategoryId=11044458#product_list","Coil Lampu Oppo 2x2.5MM Kualitas Mantap","Rp5.600","1,3RB Terjual"
"1713627386-81","https://shopee.co.id/ipenpart?originalCategoryId=11044458#product_list","Flexible Board Redmi 8 8A Original Fleksibel Sub Main Xiaomi Flexi","Rp26.600","60 Terjual"
"1713627386-82","https://shopee.co.id/ipenpart?originalCategoryId=11044458#product_list","Papan Cas Samsung A51 4G A515F Fast Charging Konektor Charger Board Flexible Flex Ces","Rp66.200","142 Terjual"
"1713627386-83","https://shopee.co.id/ipenpart?originalCategoryId=11044458#product_list","Kaca Kamera Hot 12i Infinix Lensa Camera Lense Belakang Lens X665B","Rp15.500","43 Terjual"
"1713627386-84","https://shopee.co.id/ipenpart?originalCategoryId=11044458#product_list","Konektor Lcd Redmi Note 8 Xiaomi Connector Di Mesin Original Socket Layar Soket","Rp17.300","1,4RB Terjual"
"1713627386-85","https://shopee.co.id/ipenpart?originalCategoryId=11044458#product_list","Kaca Kamera Oppo K3 Original Lensa Camera Belakang Lens","Rp9.300","34 Terjual"
"1713627386-86","https://shopee.co.id/ipenpart?originalCategoryId=11044458#product_list","IC Audio 878B Samsung A23 A235F","Rp34.300","67 Terjual"
"1713627386-87","https://shopee.co.id/ipenpart?originalCategoryId=11044458#product_list","Kaca Kamera Samsung A54 Lensa Camera Lens Belakang","Rp14.400","2 Terjual"
"1713627386-88","https://shopee.co.id/ipenpart?originalCategoryId=11044458#product_list","IC Power Pmi 8952 Redmi 3S 4X PMI8952 New Original Tested Xiaomi PMl8952","Rp44.500","917 Terjual"
"1713627386-89","https://shopee.co.id/ipenpart?originalCategoryId=11044458#product_list","Konektor Cas Saja Samsung A72 A52 Original Connector Charger Usb Ces Charging","Rp5.500","3,7RB Terjual"
"1713627386-90","https://shopee.co.id/ipenpart?originalCategoryId=11044458#product_list","Konektor Mainboard Poco F1 Original Soket Fleksibel Connector Socket Pocophone","Rp24.400","66 Terjual"
"1713627386-91","https://shopee.co.id/ipenpart?originalCategoryId=11044458#product_list","Plat Cetakan PM8150 Sm8150 Amaoe Original Mi10 BGA PM8150B SM 8150","Rp48.600","1,5RB Terjual"
"1713627386-92","https://shopee.co.id/ipenpart?originalCategoryId=11044458#product_list","IC Power MT 6332P Xiaomi Redmi Note 2 MT6332P Original","Rp18.600","107 Terjual"
"1713627386-93","https://shopee.co.id/ipenpart?originalCategoryId=11044458#product_list","Konektor Cas Aja Vivo Y30 Original Connector Charger Ces","Rp5.600","2,8RB Terjual"
"1713627386-94","https://shopee.co.id/ipenpart?originalCategoryId=11044458#product_list","Besi Lentur Tipis Pembuka Backdoor Casing Alat Congkel Original","Rp18.600","1,1RB Terjual"
"1713627386-95","https://shopee.co.id/ipenpart?originalCategoryId=11044458#product_list","Lensa Kamera Redmi Note 10 Pro 5G Lens Kaca Camera Lense Belakang","Rp13.700","6 Terjual"
"1713627386-96","https://shopee.co.id/ipenpart?originalCategoryId=11044458#product_list","Mic Redmi 8 9 10 Note 8 Modul Microphone Mikrofon Xiaomi","Rp5.600","1,9RB Terjual"
"1713627386-97","https://shopee.co.id/ipenpart?originalCategoryId=11044458#product_list","Flexible Board Samsung A72 A725F Flex Mainboard Sub Main Fleksibel","Rp38.300","642 Terjual"
"1713627386-98","https://shopee.co.id/ipenpart?originalCategoryId=11044458#product_list","IC Wifi WCN3615 Samsung A115F Original New Tested A11 WCN3615","Rp36.300","83 Terjual"
"1713627386-99","https://shopee.co.id/ipenpart?originalCategoryId=11044458#product_list","Slot Sim Tray Redmi Note 3 Mediatek Xiaom MTK Simtray Lock","Rp26.600","68 Terjual"
"1713627386-100","https://shopee.co.id/ipenpart?originalCategoryId=11044458#product_list","Papan Cas Samsung A02s A03s Fast Charging Konektor Charger Board Flexible Flex Ces","Rp54.600","161 Terjual"
"1713627386-101","https://shopee.co.id/ipenpart?originalCategoryId=11044458#product_list","Konektor Cas Aja A20s Samsung Original Connector Charger Ces Port Usb","Rp3.300","6,6RB Terjual"
"1713627386-102","https://shopee.co.id/ipenpart?originalCategoryId=11044458#product_list","Konektor Cas Aja Advan GX Original Connector Charger Port Usb Ces Only","Rp3.700","1RB Terjual"
"1713627386-103","https://shopee.co.id/ipenpart?originalCategoryId=11044458#product_list","IC R100 Resistor Original Kualitas Terbaik","Rp6.600","1,6RB Terjual"
"1713627386-104","https://shopee.co.id/ipenpart?originalCategoryId=11044458#product_list","Konektor Cas Aja ZB601KL Zenfone Max Pro M1 Asus Connector Ces Charger Port Usb","Rp2.300","5,7RB Terjual"
"1713627386-105","https://shopee.co.id/ipenpart?originalCategoryId=11044458#product_list","Kaca Kamera Infinix Note 11 Pro Lensa Camera Belakang","Rp15.500","56 Terjual"
"1713627386-106","https://shopee.co.id/ipenpart?originalCategoryId=11044458#product_list","Tombol Luar Volume Redmi 10 Outside Button Switch Xiaomi","Rp13.300","35 Terjual"
"1713627386-107","https://shopee.co.id/ipenpart?originalCategoryId=11044458#product_list","Flexible On Off Redmi Note 3 Pro Tombol Power Volume Flex Xiaomi","Rp8.600","163 Terjual"
"1713627386-108","https://shopee.co.id/ipenpart?originalCategoryId=11044458#product_list","Konektor Cas Aja A3S 2019 Oppo Connector Usb Ces Charger Only Cph1853","Rp2.250","5,8RB Terjual"
"1713627386-109","https://shopee.co.id/ipenpart?originalCategoryId=11044458#product_list","Konektor Cas Aja Redmi Note 11 Pro Connector Charger Xiaomi","Rp9.600","505 Terjual"
"1713627386-110","https://shopee.co.id/ipenpart?originalCategoryId=11044458#product_list","Konektor LCD TAB A8 2019 T290 T295 Original Soket Connector Socket Layar","Rp24.400","18 Terjual"
"1713627386-111","https://shopee.co.id/ipenpart?originalCategoryId=11044458#product_list","Tombol Luar On Off Redmi Note 7 Original Volume Power Button Outside Xiaomi","Rp14.600","1,6RB Terjual"
"1713627386-112","https://shopee.co.id/ipenpart?originalCategoryId=11044458#product_list","IC LK Backlight Redmi Note 8 Original Display Lampu Light Tested","Rp13.600","2,1RB Terjual"
"1713627386-113","https://shopee.co.id/ipenpart?originalCategoryId=11044458#product_list","Lensa Kamera Redmi Note 11 Kaca Camera Belakang Lense Xiaomi Lens","Rp11.400Rp16.600-31%","555 Terjual"
"1713627386-114","https://shopee.co.id/ipenpart?originalCategoryId=11044458#product_list","Tombol Luar On Off Redmi Note 8 Original Volume Power Button Outside Xiaomi","Rp14.400","527 Terjual"
"1713627386-115","https://shopee.co.id/ipenpart?originalCategoryId=11044458#product_list","Konektor Cas K9 Mito Advan Connector Charger Ces","Rp900","8,1RB Terjual"
"1713627386-116","https://shopee.co.id/ipenpart?originalCategoryId=11044458#product_list","Flexible Tombol On Off Volume Redmi Note 9 Xiaomi Original Switch Power Volum","Rp10.500","79 Terjual"
"1713627386-117","https://shopee.co.id/ipenpart?originalCategoryId=11044458#product_list","Kaca Lensa Kamera Y12s Vivo Original Lens Camera Belakang","Rp13.600","268 Terjual"
"1713627386-118","https://shopee.co.id/ipenpart?originalCategoryId=11044458#product_list","Konektor Cas Aja R1001 Oppo Original Connector Charger Ces X909 Port Usb Only","Rp900","10RB+ Terjual"
"1713627386-119","https://shopee.co.id/ipenpart?originalCategoryId=11044458#product_list","Kaca Lensa Kamera A70 Samsung Original Camera Belakang Lens Lense","Rp13.600","53 Terjual"
"1713627386-120","https://shopee.co.id/ipenpart?originalCategoryId=11044458#product_list","Konektor Cas Aja X662 Infinix Hot 11 Original Connector Charger Port Usb Only","Rp8.600","2,7RB Terjual"
"1713627386-121","https://shopee.co.id/ipenpart?originalCategoryId=11044458#product_list","lc Audio 338s00105 lp 7 7+ Plus","Rp34.100","867 Terjual"
"1713627386-122","https://shopee.co.id/ipenpart?originalCategoryId=11044458#product_list","Fleksibel Board Mi 12T Mi12T Pro Flexible Xiaomi Flex Sub Main","Rp44.200","8 Terjual"
"1713627386-123","https://shopee.co.id/ipenpart?originalCategoryId=11044458#product_list","Flexible Board A336B Samsung A33 5G Fleksibel Sub Main Flex","Rp43.600","122 Terjual"
"1713627386-124","https://shopee.co.id/ipenpart?originalCategoryId=11044458#product_list","Kaca Lensa Kamera Poco M5s Lense Camera Lens Belakang","Rp13.300","79 Terjual"
"1713627386-125","https://shopee.co.id/ipenpart?originalCategoryId=11044458#product_list","Glass Sudah Oca J4 Plus J610 Samsung Kaca Touchscreen LCD Layar Sentuh","Rp18.600","175 Terjual"
"1713627386-126","https://shopee.co.id/ipenpart?originalCategoryId=11044458#product_list","Flexible Papan Cas Redmi Note 10 Pro 4G Original Flex Charging Board Xiaomi","Rp64.400","44 Terjual"
"1713627386-127","https://shopee.co.id/ipenpart?originalCategoryId=11044458#product_list","IC Power Max77705F S9 Samsung Galaxy Original New Max 77705F","Rp46.200","238 Terjual"
"1713627386-128","https://shopee.co.id/ipenpart?originalCategoryId=11044458#product_list","Konektor Cas Tab T211 T116 T210 P3200 P5200 Connector Charger Original","Rp1.700","1,9RB Terjual"
"1713627386-129","https://shopee.co.id/ipenpart?originalCategoryId=11044458#product_list","IC Power Hi6522 Original New Tested Hl6522 Hi 6522","Rp43.600","59 Terjual"
"1713627386-130","https://shopee.co.id/ipenpart?originalCategoryId=11044458#product_list","Kaca Kamera Vivo Y16 Lensa Camera Lens Belakang","Rp15.500","37 Terjual"
"1713627386-131","https://shopee.co.id/ipenpart?originalCategoryId=11044458#product_list","IC Display Sm5109 Vivo Y91 Y93 Original New Tested SM 5109","Rp22.600","769 Terjual"
"1713627386-132","https://shopee.co.id/ipenpart?originalCategoryId=11044458#product_list","Flexible On Off Realme 5i Tombol Switch Flex Power","Rp8.300","66 Terjual"
"1713627386-133","https://shopee.co.id/ipenpart?originalCategoryId=11044458#product_list","Konektor Cas Aja Oppo Reno Charger Connector Ces Port Usb Plug in","Rp6.200","2,2RB Terjual"
"1713627386-134","https://shopee.co.id/ipenpart?originalCategoryId=11044458#product_list","Flex Board Infinix Zero X Neo X6810 Fleksibel Mainboard Flexible Sub","Rp56.500","157 Terjual"
"1713627386-135","https://shopee.co.id/ipenpart?originalCategoryId=11044458#product_list","Konektor Cas Aja Redmi Note 4 Original Connector Charger Ces Xiaomi Port Usb Only","Rp1.200","9RB Terjual"
"1713627386-136","https://shopee.co.id/ipenpart?originalCategoryId=11044458#product_list","Konektor Cas Aja Samsung N910 A3 A5 A7 Connector Usb Ces Only Charger","Rp5.400","622 Terjual"
"1713627386-137","https://shopee.co.id/ipenpart?originalCategoryId=11044458#product_list","Flexible Tombol On Off Volume Xiaomi Redmi Note 7 8 Original Switch Power","Rp8.400","609 Terjual"
"1713627386-138","https://shopee.co.id/ipenpart?originalCategoryId=11044458#product_list","Flexible Board Samsung A52 A526B Flex Mainboard Sub Main Fleksibel","Rp35.300","623 Terjual"
"1713627386-139","https://shopee.co.id/ipenpart?originalCategoryId=11044458#product_list","Flexible Volume A71 2017 Oppo Original Tombol Switch Fleksibel","Rp11.200","270 Terjual"
"1713627386-140","https://shopee.co.id/ipenpart?originalCategoryId=11044458#product_list","Socket Konektor FPC Flex X3 Pro Original Soket Connector Di Mesin","Rp22.100","56 Terjual"
